none,en-us,hi-in,th-th,zh-cn,zh-hk,vi-vn,id-id,in-telugu,in-marathi,pt-pt,es-es
UI.INVITE_0_main_5,Become your referral: Register successful and play {count} round games,यदि आप साझा किए गए {count} गेम . खेलते हैं तो आप सफलता साझा करेंगे,เป็นผู้แนะนำของคุณ: ลงทะเบียนสำเร็จและเล่นเกม,You will share success if the shared play {count} games,成為您的推薦人：註冊成功並玩 {count} 局遊戲,Trở thành người giới thiệu của bạn: Đăng ký thành công và chơi {count} vòng trò chơi,Ajakan anda: Pendaftaran berhasil dan bermain {Berhitung} permainan putaran.,You will share success if the shared play {count} games,You will share success if the shared play {count} games,"Torne-se seu referenciador: registre-se com sucesso, jogue o jogo {count}",Conviértase en su referencia: regístrese con éxito y juegue {count} rondas
UI.MakeMoney_0_main_9,My ID,मेरी पहचान,ตำแหน่งของฉัน,My ID,我的身份,ID của tôi,ID Saya,నా ఐడి,माझी आयडी,Meu ID,Mi identificación
UI.MakeMoney_0_main_11_1,Total commission,कुल कमीशन,ค่าคอมมิชชั่นทั้งหมด,Total commission,總佣金,Tổng hoa hồng,Total Komisi,మొత్తం కమిషన్,एकूण कमिशन,Comissão total,Comisión total
UI.MakeMoney_0_main_14,Copy your link and share it with friends.,अपने लिंक को कॉपी करें और दोस्तों के साथ साझा करें।,คัดลอกลิงค์ของคุณและแชร์ให้เพื่อน,Copy your link and share it with friends.,複製您的鏈接並與朋友分享。,Sao chép link của bạn và chia sẻ với bạn bè.,Salin link anda dan bagikan kepada teman.,మీ లింక్,आपला दुवा कॉपी करा आणि आपल्या मित्रांसह सामायिक करा,Copie seu link e compartilha com seus amigos.,Copia tu enlace y compártelo con amigos
UI.MakeMoney_0_main_15,Copy link,लिंक को कॉपी करें,คัดลอกลิงค์,Copy link,複製鏈接,Sao chép link,Menyalin Link,లింక్ను కాపీ చేయండి,दुवा कॉपी करा,Copiar,Copiar link
UI.MakeMoney_0_main_16,One click sharing to social platform,सोशल प्लेटफॉर्म पर एक क्लिक साझा करना,คลิกเดียวแชร์ไปยังแพลตฟอร์มโซเชียล,One click sharing to social platform,一鍵分享到社交平台,Chia sẻ lên nền tảng xã hội bằng một cú nhấp chuột,Berbagi satu klik ke platform sosial,సామాజిక వేదికకు ఒక క్లిక్ భాగస్వామ్యం,सामाजिक व्यासपीठावर एक क्लिक सामायिकरण,Compartilhe na rede social com um click,Compartir con un clic en la plataforma social
UI.MakeMoney_0_main_17,Receive,प्राप्त करना,ได้รับ,Receive,收到,Nhận được,Menerima,స్వీకరించండి,प्राप्त करा,Receber,Recibir
UI.MakeMoney_0_main_18,Transfer,प्राप्त करना,ได้รับ,Receive,收到,Chuyển khoản,Menerima,స్వీకరించండి,प्राप्त करा,Transferir,Transferir
UI.MakeMoney_0_main_19,New top-up players,नए टॉप-अप खिलाड़ी,ผู้เล่นเติมเงินใหม่,New top-up players,下级首冲人数,Người chơi nạp tiền mới,Pemain top-up baru,కొత్త టాప్-అప్ ప్లేయర్లు,नवीन टॉप-अप खेळाडू,Novos jogadores de recarga,Nuevos jugadores de recarga
UI.MakeMoney_1_MakeGold_1,Level,स्तर,ระดับ,Level,等級,Cấp,Tingkat,స్థాయి,पातळी,Nivel,Nivel 
UI.MakeMoney_3_MyCommission_5,Time,पहर,เวลา,时间,時間,Thời gian,waktu,సమయం,वेळ,Hora,Tiempo tiempo
UI.MakeMoney_3_MyCommission_10,Game,खेल,เกม,Game,遊戲,Trò chơi,Permainan,ఆట,खेळ,Jogo,Juego
UI.MakeMoney_3_MyCommission_11,Level 1 commission,स्तर 1 आयोग,ค่าคอมมิชชั่นระดับที่หนึ่ง,Code amount,一級佣金,Hoa hồng cấp 1,Komisi tingkat 1,కోడ్ మొత్తం,कोड रक्कम,Comissão de nível 1,comisión de nivel 1
UI.MakeMoney_3_MyCommission_12,Contributors,योगदानकर्ता,ผู้ให้,Contributors,貢獻者,Người đóng góp,Kontribusi,సహాయకులు,योगदानकर्ता,Contribuidores,Colaboradores
UI.MakeMoney_3_MyCommission_13,Commission,आयोग,ค่าคอมมิชชั่น,Commission,佣金,Nhiệm vụ,Komisi,కమిషన్,आयोग,Comissão,Comisión
UI.MakeMoney_3_MyCommission_14,His commission,His commission,His commission,His commission,His commission,His commission,His commission,His commission,His commission,His commission,His commission
UI.MakeMoney_1_Sharetoearn_1,Commission,आयोग,ค่าคอมมิชชั่น,Commission,佣金,Nhiệm vụ,Komisi,కమిషన్,आयोग,Comissão,Comisión
UI.MakeMoney_1_Sharetoearn_2,Referrer ID,रेफ़रर आईडी,ID ผู้แนะนำ,Referrer ID,推薦人 ID,ID người giới thiệu,ID Pengajak,రిఫరర్ ఐడి,रेफरर आयडी,ID referência,Identificacion de referente
UI.MakeMoney_1_Sharetoearn_3,Directly added today,आज सीधे जोड़ा गया,วันนี้เพิ่มโดยตรงแล้ว,Directly added today,今天直接加了,Hôm nay được thêm trực tiếp,Langsung di tmbahkan hari ini,ఈ రోజు నేరుగా జోడించబడింది,आज थेट जोडले,Diretamente acrescentado hoje,Añadido directamente hoy
UI.MakeMoney_1_Sharetoearn_4,Number of direct members,प्रत्यक्ष सदस्यों की संख्या,จำนวนสมาชิกโดยตรง,Number of direct members,直接成員數量,Số thành viên trực tiếp,Jumlah anggota langsung,ప్రత్యక్ష సభ్యుల సంఖ్య,थेट सदस्यांची संख्या,Número de membros diretos,Número de miembros directos
UI.MakeMoney_1_Sharetoearn_5,Today's team added,आज की टीम गयी,การเพิ่มเติมของทีมในวันนี้,Today's team added,今天的團隊補充,Nhóm đã thêm hôm nay,Penambahan Tim Hari ini,నేటి జట్టు జోడించబడింది,आजची टीम जोडली,A equipe de hoje acrescentou,Equipos añadidos del día de hoy
UI.MakeMoney_1_Sharetoearn_6,Number of team,टीम की संख्या,จำนวนทีม,Number of team,隊伍數量,Số lượng đội,Jumlah TIm,జట్టు సంఖ్య,संघांची संख्या,Número de Equipe(nova),Número del equipo
UI.MakeMoney_1_Sharetoearn_7,Get commission today,आज ही कमीशन लें,ค่าคอมมิชชั่นที่ได้รับในวันนี้,Get commission today,今天獲得佣金,Nhận hoa hồng hôm nay,Ambil Komisi hari ini,ఈ రోజు కమిషన్ పొందండి,आज कमिशन मिळवा,Obter comissão hoje,Obtener comisión hoy
UI.MakeMoney_1_Sharetoearn_8,Got commission yesterday,कल कमीशन मिला,ค่าคอมมิชชั่นที่ได้รับในเมื่อวาน,Got commission yesterday,昨天收到佣金,Đã nhận hoa hồng hôm qua,Ambil Komisi kemarin,నిన్న కమిషన్ వచ్చింది,काल कमिशन मिळाला,Recebi comissão ontem,Obtuvo comisión ayer 
UI.MakeMoney_4_Promotion_3,Rewards,पुरस्कार,รางวัล,Rewards,獎勵,Thưởng,Penghargaan,బహుమతులు,बक्षिसे,Recompensas,Recompensas
UI.MakeMoney_4_Promotion_6,Direct members,प्रत्यक्ष सदस्य,สมาชิกโดยตรง,Direct members,直接成員,Thành viên trực tiếp,Anggota langsung,ప్రత్యక్ష సభ్యులు,थेट सदस्य,Membros diretos(novos),Miembros directos
UI.MakeMoney_4_Promotion_12,Enter ID,आईडी दर्ज करें,โปรดใส่ ID,Enter ID,輸入身份證,Nhập ID,masukan ID,ఐడిని నమోదు చేయండి,आयडी प्रविष्ट करा,Introduz ID,Ingresar ID
UI.MakeMoney_4_Promotion_13,ID,आईडी,รหัส,ID,ID,ID,ID,ఐడి,आयडी,ID,Identificación
UI.MakeMoney_4_Promotion_15,Betting,शर्त,การเดิมพัน,Betting,投注,Cược,Bertaruh,బెట్టింగ్,बेटिंग,Apostar,Apuesta
UI.MakeMoney_4_Promotion_17,Recharge,फिर से दाम लगाना,เติมเงิน,Recharge,充值,Nạp,Pengisian ulang,రీఛార్జ్,पुनर्भरण,Recarrega,Recargo
UI.MakeMoney_4_Promotion_19,All,सब,ทั้งหมด,所有,所有,Tất cả,semua,అందరూ,सर्व,Todo,Todos
UI.MakeMoney_4_Promotion_20,Today,आज,วันนี้,Today,今天,Hôm nay,Hari ini,ఈ రోజు,आज,Hoje,Hoy
UI.MakeMoney_4_Promotion_22,This week,इस सप्ताह,ในสัปดาห์นี้,This week,本星期,Tuần này,Minggu ini,ఈ వారం,या आठवड्यात,Essa semana,Esta semana
UI.MakeMoney_4_Promotion_23,Last week,पिछले सप्ताह,สัปดาห์ที่แล้ว,Last week,上週,Tuần trước,Minggu kemarin,గత వారం,गेल्या आठवड्यात,Semana Anterior,Semana pasada
UI.MakeMoney_4_Promotion_24,This month,इस महीने,เดือนนี้,This month,這個月,Tháng này,Bulan ini,ఈ నెల,या महिन्यात,1 mês,Este mes
UI.MakeMoney_4_Promotion_32,1 day,1 दिन,1 วัน,1 day,1天,1 ngày,1 Hari,1 రోజు,1 दिवस,1 dia,Día 1
UI.MakeMoney_4_Promotion_33,3 days,3 दिन,3 วัน,3 days,3天,3 ngày,3 Hari,3 రోజులు,3 दिवस,3 dias,Día 3
UI.MakeMoney_4_Promotion_36,Deposit Amount,जमा राशि,จำนวนเงินฝาก,Deposit value,存款金額,Số tiền gửi,Jumlah Setoran,Deposit value,Deposit value,Valor do depósito,Cantidad del depósito
UI.MakeMoney_5_Withdrawal_3,Time,पहर,เวลา,时间,時間,Thời gian,waktu,సమయం,वेळ,Hora,Tiempo tiempo
UI.MakeMoney_5_Withdrawal_6,Status,स्थिति,สถานะ,Status,狀態,Trạng thái,Status,స్థితి,स्थिती,Status,Estado
UI.MakeMoney_6_Direct_3,Search,खोज,ค้นหา,Search,搜索,Tìm kiếm,Pencarian,వెతకండి,शोध,Procurar,Buscar
UI.Head_1_name_2,16 English digits,16 अंग्रेजी अंक,ตัวอักษรอังกฤษและตัวเลข 16 หลัก,16 English digits,16 位英文數字,12 chữ số tiếng anh,16 digit bahasa inggris,16 ఆంగ్ల అంకెలు,16 इंग्रजी अंक,16 dígitos,16 dígitos ingleses
UI.Notice_0_main_1,Promotions,गतिविधि,โปรโมชั่น,Activity,促銷活動,Khuyến mãi,Promosi,కార్యాచరణ,क्रियाकलाप,promoção,Promociones
UI.Notice_0_main_2,Notice,नोटिस,สังเกต,Notice,注意,Chú ý,Melihat,నోటీసు,सूचना,Aviso,noticia
UI.Notice_left,Left,बाएं,เสร็จสิ้น,Left,結束,bên trái,kiri,Left,Left,Restante,izquierda
UI.OrderType_1,Successf,सफल,Successf,Successf,成功,Thành công,Berhasil,Successf,Successf,Bem-sucedido,Exitoso
UI.OrderType_2,In Reocess,रीकेस में,In Reocess,In Reocess,處理中,Đang cập nhật,Di Reocess,In Reocess,In Reocess,En Receso,En Receso
UI.OrderType_3,Cancelled,रद्द कर दिया,Cancelled,Cancelled,拒絕,Đã hủy,Dibatalkan,Cancelled,Cancelled,Cancelado,Cancelado
UI.Service_0_main_2,Copy PIX Code,प्रतिलिपि,คัดลอกรหัส PIX,Copy,複製 PIX 代碼,Sao chép mã PIX,Salin Kode PIX,కాపీ,प्रत,Copiar Código PIX,Copiar código PIX
UI_copy,Copy,प्रतिलिपि,คัดลอก,Copy,複製,Sao chép,Salinan,Copy,Copy,cópia de,copiar 
UI.Settings_0_main_1,Settings,समायोजन,ตั้งค่า,Settings,設置,Cài đặt,Pengaturan,సెట్టింగులు,सेटिंग्ज,Conjunto,ajustes
UI.Settings_0_main_2,Sound,ध्वनि,เสียง,Sound,聲音,Âm thanh,Suara,ధ్వని,आवाज,Som,Sonido
UI.Settings_0_main_3,Vibration,कंपन,การสั่นสะเทือน,Vibration,振動,Rung,Getaran,కంపనం,कंप,Vibração,vibración
UI.Settings_0_main_5,Help,मदद,ช่วยเหลือ,Help,幫助,Giúp đỡ,Bantuan,సహాయం,मदत,Ajuda,Ayuda
UI.Settings_0_main_6,Logout,लॉग आउट,ออกจากระบบ,Logout,登出,Đăng xuất,Keluar,లాగ్ అవుట్,लॉग बाहेर,Sair,Cerrar sesión
UI.Settings_1_Help_2,Pure Sequence,शुद्ध अनुक्रम,ลำดับที่บริสุทธิ์,Pure Sequence,純序列,Sảnh thuần khiết,Rangkaian Sempurna,స్వచ్ఛమైన క్రమం,शुद्ध क्रम,Sequência Pura,secuencia pura (escalera de color)
UI.Settings_1_Help_9,Unfold,उधेड़ना,ขยาย,Show,展開,Lật bài,Pertunjukan,చూపించు,दाखवा,Desdobrar,Desplegar
UI.Settings_1_Help_15,Score,स्कोर,คะแนน,Score,分數,Điểm,Skor,స్కోరు,धावसंख्या:,Pontuação,puntuación
UI_Music,Music,संगीत: पर,เพลง：เปิด,Music,音樂：開,Nhạc,Musik,Music,Music,Soar,Música
UI_LoginMailText,LoginMailText,कृपया ईमेल प्रकार चुनें,กรุณาเลือกประเภทอีเมล์,LoginMailText,請選擇郵箱類型,Vui lòng chọn loại email,Silakan pilih jenis email,LoginMailText,LoginMailText,Selecione o tipo de e-mail,Seleccione el tipo correo electrónico
UI.Login_0_main_1,Phone number,फ़ोन नंबर,หมายเลขโทรศัพท์,Phone number,電話號碼,Số điện thoại,Nomor telepon,ఫోను నంబరు,फोन नंबर,Telefone n.o,Número de teléfono
UI.Login_0_main_2,New Password,नया पासवर्ड,รหัสผ่าน,Password,新密碼,Mật khẩu mới,Sandi Baru,పాస్వర్డ్,संकेतशब्द,Nova Senha,Nueva contraseña
UI.Login_0_main_10,Code,कोड,รหัสยืนยัน,OTP,驗證碼,Mã số,Kode,OTP,OTP,Código,Código
UI.Login_0_main_11,Change,परिवर्तन,แก้ไข,Change,修改,Thay đổi,Perubahan,మార్పు,बदल,Mudar,Cambiar 
UI.Login_0_main_22,<<Login,<<लॉग इन करें,<< เข้าสู่ระบบ,<<Login,<<登錄,<< Đăng nhập,<<Masuk,<< లాగిన్,लॉगिन,<<Entrar,<<iniciar sesión
UI.System_1,"No operation,leave the room","कोई ऑपरेशन नहीं, कमरा छोड़ दो",ไม่มีการดำเนินการ ออกจากห้อง,"No operation,leave the room",無操作，離開房間,"Không thao tác, rời khỏi phòng","Tidak ada operasi, keluar dari ruangan","ఆపరేషన్ లేదు, గదిని వదిలివేయండి","ऑपरेशन नाही, खोली सोडा","Sem operação, saiam da sala","no hay operación, salga de la habitación"
UI.System_2,Please enter your Mobile Phone Number,कृपया अपना मोबाइल फ़ोन नंबर दर्ज करें,กรุณาใส่หมายเลขโทรศัพท์ของคุณ,Please enter your Mobile Phone Number,請輸入您的手機號碼,Hãy nhập số điện thoại di động của bạn,Silakkan masukan Nomor Ponsel Anda,దయచేసి మీ మొబైల్ ఫోన్ నంబర్,कृपया आपला मोबाइल फोन नंबर प्रविष्ट करा,"Por favor, introduza seu número de telefone celular",por favor ingrese su número móvil
UI.System_4,Please input password,कृपया पासवर्ड डालें,กรุณาใส่รหัสผ่าน,Please input password,請輸入密碼,Hãy nhập mật khẩu,Silakkan masukan kata sandi,దయచేసి పాస్వర్డ్ను ఇన్పుట్ చేయండి,कृपया संकेतशब्द प्रविष्ट करा,"Por favor, introduzir a senha",por favor ingrese la contraseña
UI.System_7,Sorry we are updating our system right now please try again later,क्षमा करें हम अपने सिस्टम को अभी अपडेट कर रहे हैं कृपया बाद में पुनः प्रयास करें,ขออภัย เรากำลังอัปเดตระบบของเราในขณะนี้ โปรดลองอีกครั้งในภายหลัง,Sorry we are updating our system right now please try again later,抱歉，我們現在正在更新我們的系統，請稍後再試,"Rất tiếc, chúng tôi hiện đang cập nhật hệ thống, vui lòng thử lại sau","Mohon maaf, kami sedang melakukan perbaikan sistem saat ini, silakkan coba beberapa saat lagi","క్షమించండి, మేము ప్రస్తుతం మా సిస్టమ్",क्षमस्व आम्ही आत्ता आमची सिस्टम अद्यतनित करीत आहोत कृपया नंतर पुन्हा प्रयत्न करा,Desculpe que estamos atualizando nosso sistema agora por favor tente de novo mais tarde,"Lo sentimos, estamos actualizando nuestro sistema en este momento. por favor, Vuelva a intentarlo más tarde."
UI.System_10,Redemption amount is wrong,मोचन राशि गलत है,จำนวนเงินที่แลกเปลี่ยนไม่ถูกต้อง,Redemption amount is wrong,兌換金額錯誤,Số tiền đổi thưởng sai,Jumlah penebusan salah,విముక్తి మొత్తం తప్పు,विमोचन रक्कम चुकीची आहे,A quantidade de redenção esta errada,el importe del canje es incorrecto
UI.System_14,Please enter the withdrawal amount,कृपया निकासी राशि दर्ज करें,กรุณาใส่จำนวนเงินที่จะถอน,Please enter the exchange amount,請輸入提款金額,Hãy nhập số tiền rút,Silakan masukan jumlah penarikan,దయచేసి మార్పిడి మొత్తాన్ని నమోదు చేయండి,कृपया विनिमय रक्कम प्रविष्ट करा,Por favor ingrese el monto del retiro,por favor ingrese el monto del retiro
UI.System_15,bind Success！,बाइंड सक्सेस！,การผูกมัดสำเร็จ,bind Success！,綁定成功！,Liên kết thành công!,penautan Sukses！,విజయవంతం!,यशस्वी बंधन！,Ligação bem sucedida,¡vinculación exitosa!
UI.System_17,Please enter the UserName,कृपया उपयोगकर्ता नाम दर्ज करें,กรุณาใส่ชื่อผู้ใช้,Please enter the UserName,請輸入用戶名,Hãy nhập tên người dùng,Silakan masukan Nama Pengguna,దయచేసి వినియోగదారు పేరును నమోదు చేయండి,कृपया वापरकर्तानाव प्रविष्ट करा,Introduzir o Nome de Usuario,por favor ingrese el nombre de usuario
UI.System_18,Please enter Phone,कृपया फ़ोन दर्ज करें,กรุณาใส่หมายเลขโทรศัพท์,Please enter Phone,請輸入電話,Hãy nhập điện thoại,Silakan masukan Telepon,దయచేసి ఫోన్ నంబర్,कृपया फोन प्रविष्ट करा,"Por favor, introduzir o telefone",por favor ingrese teléfono
UI.System_19,Please enter Email,कृपया ईमेल दर्ज करें,กรุณาใส่อีเมลของคุณ,Please enter Email,請輸入郵箱,Hãy nhập Email,Silakan masukan Email,దయచేసి ఇమెయిల్,कृपया ईमेल प्रविष्ट करा,"Por favor, introduzir o Email",por favor ingrese correo electrónico
UI.System_20,Please enter the correct email,कृपया सही ईमेल दर्ज करें,กรุณาใส่อีเมล,Please enter the correct email,請輸入正確的郵箱,Hãy nhập đúng email,masukan email yang benar,దయచేసి సరైన ఇమెయిల్,कृपया योग्य ईमेल प्रविष्ट करा,Escreva o correto e-mail,por favor ingrese correctamente el correo electrónico 
UI.System_22,Please enter the amount,कृपया राशि दर्ज करें,กรุณาใส่จำนวนเงิน,Please enter the amount,請輸入金額,Hãy nhập số tiền,masukan jumlahnya,దయచేసి మొత్తాన్ని నమోదు చేయండి,कृपया रक्कम प्रविष्ट करा,"Por favor, inserir a quantidade",por favor ingrese el importe
UI.System_24,Please enter your nickname,कृपया अपना उपनाम दर्ज करें,กรุณาใส่ชื่อเล่นของคุณ,Please enter your nickname,請輸入您的暱稱,Hãy nhập nickname của bạn,Silakan masukan nama panggilan Anda,దయచేసి మీ మారుపేరు నమోదు చేయండి,कृपया आपले टोपणनाव प्रविष्ट करा,"Por favor, introduzir seu apelido",por favor ingrese su apodo
UI.System_25,Activity time end,गतिविधि का समय समाप्त,กิจกรรมสิ้นสุดลง,Activity time end,活動時間結束,Thời gian hoạt động kết thúc,Waktu aktivitas berakhir,కార్యాచరణ సమయం ముగింపు,क्रियाकलाप वेळ समाप्त,Tempo de atividade final,fin de tiempo de actividad
UI.System_26,The Maximum recharge amount is,अधिकतम रिचार्ज राशि है,จำนวนการเติมสูงสุดคือ,The Maximum recharge amount is,最大充值金額為,Số tiền nạp tối đa là,Jumlah pengisian ulang maksimum adalah,గరిష్ట రీఛార్జ్ మొత్తం,जास्तीत जास्त रिचार्ज रक्कम आहे,A quantidade máxima de recarga é,el importe máximo de recarga es 
UI.System_27,The minimum recharge amount is,न्यूनतम रिचार्ज राशि है,จำนวนเงินที่เติมขั้นต่ำคือ,The minimum recharge amount is,最低充值金額為,Số tiền nạp tối thiểu là,Jumlah pengisian ulang minimum adalah,కనీస రీఛార్జ్ మొత్తం,किमान पुनर्भरण रक्कम आहे,A quantidade mínima de recarga é,el importe mínimo de recarga es 
UI.System_34,Not enough chips，Unable to enter the room，please recharge.,"चिप्स कम हैं। कमरे में प्रवेश करने में असमर्थ, कृपया रिचार्ज करें।",ชิปไม่พอ เข้าห้องไม่ได้ กรุณาเติมเงินก่อน,Not enough chips，Unable to enter the room，please recharge.,籌碼不足，無法進房，請充值。,"Không đủ Phỉnh, không thể vào phòng, hãy đi nạp.",Chips tidak cukup，Tidak dapat memasuki ruangan，silakan melakukan pengisian ulang.,తగినంత చిప్స్ లేవు the గదిలోకి ప్రవేశించడం సాధ్యం కాలేదు ， దయచేసి రీఛార్జ్ చేయండి.,"पुरेशी चिप्स नाही, खोलीत प्रवेश करण्यात अक्षम ， कृपया रिचार्ज करा","Não há moedas suficientes, não é possível entrar na sala, por favor recarregue.","no hay suficientes fichas, no se puede ingresar a la sala, por favor recargue"
