none,en-us,hi-in,th-th,zh-cn,zh-hk,vi-vn,id-id,in-telugu,in-marathi,pt-pt,es-es
UI_Wheel_HelpTit2,Today‘s player recharge amount,आज की खिलाड़ी पुनर्भरण राशि,ยอดเติมเงินของผู้เล่นวันนี้,Today’s player recharge amount,今日玩家充值金額,Số tiền nạp của người chơi hôm nay,Jumlah isi ulang pemain hari ini,నేటి ప్లేయర్ రీఛార్జ్ మొత్తం,आजची खेळाडू रिचार्ज रक्कम,Valor de recarga do jogador de hoje,Monto de recarga del jugador de hoy
UI_Wheel_HelpTit3,Yesterday's player recharge amount,कल के खिलाड़ी की पुनर्भरण राशि,ยอดเติมเงินของผู้เล่นเมื่อวานนี้,Yesterday's player recharge amount,昨日玩家充值金額,Số tiền nạp lại của người chơi ngày hôm qua,Jumlah isi ulang pemain kemarin,నిన్నటి ప్లేయర్ రీఛార్జ్ మొత్తం,कालच्या खेळाडूच्या रिचार्जची रक्कम,Valor de recarga do jogador de ontem,Monto de recarga del jugador de ayer
UI_Wheel_Helptxt1,Accumulated recharge amount,संचित पुनर्भरण राशि,ยอดเติมเงินสะสม,Accumulated recharge amount,累計充值金額,Số tiền nạp tích lũy,Akumulasi jumlah isi ulang,సేకరించిన రీఛార్జ్ మొత్తం,जमा झालेली रिचार्ज रक्कम,Valor de recarga acumulada,Monto de recarga acumulada
UI_Wheel_Helptxt3,Number of spins,घुमावों की संख्या,จำนวนการหมุน,Number of spins,旋轉次數,Số lần quay,Jumlah putaran,స్పిన్‌ల సంఖ్య,फिरकीची संख्या,Número de rodadas,Número de giros
UI_Wheel_Helptxt2,Recharge amount,पुनर्भरण राशि,จำนวนการเติมเงิน,Recharge amount,充值金額,Số tiền nạp,Jumlah isi ulang,రీఛార్జ్ మొత్తం,रिचार्ज रक्कम,Valor de recarga,Monto de recarga
UI_Cash_BankCard,Bank Card,बैंक कार्ड,บัตรเครดิตธนาคาร,Bank Card,銀行卡,Thẻ ngân hàng,Kartu bank,Bank Card,Bank Card,Bank Card,Tarjeta bancaria
UI_Cash_GCASH,GCASH,जीकाश,GCASH,GCASH,GCASH,GCASH,GCASH,GCASH,GCASH,GCASH,GCASH
UI_Cash_InputProvince,Input Province,इनपुट प्रांत,ใส่ชื่อของจังหวัด,Input Province,輸入省份,Nhập tỉnh,masukan Provinsi,Input Province,Input Province,Input Province,ingrese provincia
UI_Cash_InputCity,Input City,इनपुट सिटी,ใส่ชื่อของเมือง,Input City,輸入城市,Nhập thành phố,Masukan Kota,Input City,Input City,Input City,ingrese ciudad
UI_Cash_InputNumber,Input Number,इनपुट नंबर,ป้อนหมายเลข,Input Number,輸入號碼,Nhập số,Masukan Nomor,Input Number,Input Number,Input Number,ingrese número
UI_Cash_InputMayaNumber,Input Maya Phone Number,माया फ़ोन नंबर इनपुट करें,ใส่หมายเลขโทรศัพท์มายา,Input Maya Phone Number,輸入 Maya 電話號碼,Nhập số điện thoại Maya,Masukkan Nomor Telepon Maya,మాయ ఫోన్ నంబర్ని ఇన్పుట్ చేయండి,माया फोन नंबर इनपुट करा,Insira o número de telefone do Maya,Ingrese el número de teléfono de Maya
UI_Cash_StarColor_Province,<b><color=#495669>Province</color><color=#ff0000>*</color></b>,<b><color=#495669>प्रान्त</color><color=#ff0000>*</color></b>,<b><color=#495669>จังหวัด</color><color=#ff0000>*</color></b>,<b><color=#495669>Province</color><color=#ff0000>*</color></b>,<b><color=#495669>省</color><color=#ff0000>*</color></b>,<b><color=#495669>Tỉnh</color><color=#ff0000>*</color></b>,<b><color=#495669>Provinsi</color><color=#ff0000>*</color></b>,<b><color=#495669>Province</color><color=#ff0000>*</color></b>,<b><color=#495669>Province</color><color=#ff0000>*</color></b>,<b><color=#495669>Province</color><color=#ff0000>*</color></b>,<b><color=#495669>Provincia</color><color=#ff0000>*</color></b>
UI_Cash_TitleBankNameGCash,Bank name/Gcash/PayMaya Philippines,बैंक का नाम/जीकैश,ชื่อธนาคาร/Gcash/PayMaya Philippines,Bank name/Gcash/PayMaya Philippines,銀行名稱/Gcash/PayMaya Philippines,Tên ngân hàng/Gcash/PayMaya Philippines,Nama bank/Gcash/PayMaya Philippines,Bank name/Gcash/PayMaya Philippines,Bank name/Gcash/PayMaya Philippines,Bank name/Gcash/PayMaya Philippines,Nombre del banco/Gcash/PayMaya Philippines
UI_Cash_StarColor_City,<b><color=#495669>City</color><color=#ff0000>*</color></b>,<b><color=#495669>शहर</color><color=#ff0000>*</color></b>,<b><color=#495669>เมือง</color><color=#ff0000>*</color></b>,<b><color=#495669>City</color><color=#ff0000>*</color></b>,<b><color=#495669>城市</color><color=#ff0000>*</color></b>,<b><color=#495669>Thành phố</color><color=#ff0000>*</color></b>,<b><color=#495669>Kota</color><color=#ff0000>*</color></b>,<b><color=#495669>City</color><color=#ff0000>*</color></b>,<b><color=#495669>City</color><color=#ff0000>*</color></b>,<b><color=#495669>City</color><color=#ff0000>*</color></b>,<b><color=#495669>Ciudad</color><color=#ff0000>*</color></b>
UI_Cash_StarColor_Number,<b><color=#495669>Gcash ACC</color><color=#ff0000>*</color></b>,<b><color=#495669>जीकैश एसीसी</color><color=#ff0000>*</color></b>,<b><color=#495669>Number</color><color=#ff0000>*</color></b>,<b><color=#495669>Number</color><color=#ff0000>*</color></b>,<b><color=#495669>Gcash ACC</color><color=#ff0000>*</color></b>,<b><color=#495669>ACC Gcash</color><color=#ff0000>*</color></b>,<b><color=#495669>Gcash ACC</color><color=#ff0000>*</color></b>,<b><color=#495669>Number</color><color=#ff0000>*</color></b>,<b><color=#495669>Number</color><color=#ff0000>*</color></b>,<b><color=#495669>Gcash ACC</color><color=#ff0000>*</color></b>,<b><color=#495669>Caja Gcash</color><color=#ff0000>*</color></b>
UI_Finish,Done,हो गया,เสร็จสิ้น,Finish,完畢,Xong,Selesai,Finish,Finish,OK,Hecho
UI_LimitTitle,This game is not available in your country.,This game is not available in your country.,เกมนี้ไม่มีให้บริการได้ในประเทศ/พื้นที่ที่คุณอยู่,This game is not available in your country.,This game is not available in your country.,Game này không được dùng tại quốc gia của bạn.,This game is not available in your country.,This game is not available in your country.,This game is not available in your country.,Este jogo não está disponível em seu país.,Este juego no está disponible en tu país.
UI_Due_to,"Due to licensing regulation laws,we cannot offer our services to you.","लाइसेंसिंग विनियमन कानूनों के कारण, हम आपको अपनी सेवाएं प्रदान नहीं कर सकते हैं।",เนื่องจากกฎหมายควบคุมการออกใบอนุญาต เราไม่สามารถให้บริการแก่คุณได้,"Due to licensing regulation laws,we cannot offer our services to you.",由於許可法規，我們無法為您提供服務。,"Do quy định về cấp phép, chúng tôi không thể cung cấp dịch vụ cho bạn.","Karena undang-undang peraturan perizinan, kami tidak dapat menawarkan layanan kami kepada Anda.","Due to licensing regulation laws,we cannot offer our services to you.","Due to licensing regulation laws,we cannot offer our services to you.","Devido às leis de regulamentação de licenciamento, não podemos oferecer nossos serviços a você.","Debido a las leyes de regulación de licencias, no podemos ofrecerle nuestros servicios."
UI_Not_region,Not in a restricted region?,प्रतिबंधित क्षेत्र में नहीं?,ไม่อยู่ในเขตหวงห้าม?,Not in a restricted region?,不在禁區？,Không trong khu vực hạn chế?,Bukan di wilayah terlarang?,Not in a restricted region?,Not in a restricted region?,TermNão está em uma região restrita?inar,¿No está en una región restringida?
UI_USING_VPN,"If you're using aproxy service or VPN to access,try turning it off and reload the page.","If you're using aproxy service or VPN to access,try turning it off and reload the page.",หากคุณใช้บริการ aproxy หรือ VPN ในการเข้าถึง ให้ลองปิดและโหลดหน้านี้ใหม่,"If you're using aproxy service or VPN to access,try turning it off and reload the page.","If you're using aproxy service or VPN to access,try turning it off and reload the page.","Nếu bạn đang sử dụng dịch vụ Đại lý hoặc VPN để truy cập, hãy thử tắt và tải lại trang.","If you're using aproxy service or VPN to access,try turning it off and reload the page.","If you're using aproxy service or VPN to access,try turning it off and reload the page.","If you're using aproxy service or VPN to access,try turning it off and reload the page.","Se você estiver usando um serviço de proxy ou VPN para acessar, tente desligá-lo e recarregar a página.","Si está utilizando un servicio proxy o VPN para acceder, intente apagarlo y recargar la página."
UI_Contact_Support,Refresh,रिफ्रेश,รีเฟรช,Contact Support,刷新,Làm mới,Menyegarkan,Contact Support,Contact Support,Atualizar,Actualizar
UI_Contact_Customer_Service,Contact Support,संपर्क सहायता,โปรดติดต่อฝ่ายสนับสนุน,Contact Support,聯繫支持,Liên hệ hỗ trợ,Hubungi Dukungan,Contact Support,Contact Support,Contate o Suporte,Soporte de contacto
UI_Server_maintenance,"Network connection failed, please contact customer service","नेटवर्क कनेक्शन विफल रहा, कृपया ग्राहक सेवा से संपर्क करें",การเชื่อมต่อเครือข่ายล้มเหลว โปรดติดต่อฝ่ายบริการลูกค้า,"Network connection failed, please contact customer service",網絡連接失敗，請聯繫客服,"Kết nối mạng thất bại, hãy liên hệ CSKH","Koneksi jaringan gagal, silakan hubungi layanan pelanggan","Network connection failed, please contact customer service","Network connection failed, please contact customer service","Falha na conexão de rede, entre em contato com o atendimento ao cliente","La conexión de red falló, comuníquese con el servicio al cliente"
UI_Shop_Red_explain,"Redemption codes will be issued through events from time to time, please pay attention to the announcement in the official group","समय-समय पर घटनाओं के माध्यम से मोचन कोड जारी किए जाएंगे, कृपया आधिकारिक समूह में घोषणा पर ध्यान दें",จะแจกจ่ายรหัสแลกรับรางวัลผ่านกิจกรรมเป็นช่วงๆ โปรดสังเกตการประกาศของกลุ่มอย่างเป็นทางการ,"Redemption codes will be issued through events from time to time, please pay attention to the announcement in the official group",兌換碼將不定期通過活動發放，請關注官群公告,"Mã đổi thưởng sẽ được phát hành không định kỳ thông qua các sự kiện, hãy theo dõi thông báo trong nhóm chính thức","Kode penukaran akan dikeluarkan melalui acara dari waktu ke waktu, harap perhatikan pengumuman di grup resmi","Redemption codes will be issued through events from time to time, please pay attention to the announcement in the official group","Redemption codes will be issued through events from time to time, please pay attention to the announcement in the official group","Os códigos de resgate serão emitidos através de eventos de tempos em tempos, preste atenção ao anúncio no grupo oficial","Los códigos de canje se emitirán a través de eventos de vez en cuando, preste atención al anuncio en el grupo oficial"
UI_Shop_Red_PleaseEnter,Please enter the redeem code,कृपया रिडीम कोड दर्ज करें,กรุณาใส่รหัสแลกของรางวัล,Please enter the gift pack redemption code,請輸入兌換碼,Hãy nhập mã đổi thưởng,Silakan masukan kode penukaran,Please enter the gift pack redemption code,Please enter the gift pack redemption code,"Por favor, insira o código de resgate","Por favor, introduzca el código de canje"
UI_Shop_Red_Redpackets,Redeem Code,कोड भुनाएं,รหัสแลกของรางวัล,Red packets,兌換碼,Mã đổi,Kode penukaran,Red packets,Red packets,Resgatar código,Canjear código
UI_Contact_customer,Contact Customer Service,संपर्क ग्राहक सेवा,ติดต่อฝ่ายบริการลูกค้า,Contact Customer Service,聯繫客服,Liên hệ CSKH,Hubungi Layanan Pelanggan,Contact Customer Service,Contact Customer Service,Entre em contato com o Atendimento ao Cliente,Contactar Servicio al Cliente
UI_Beneficiary_Name,Beneficiary Name,लाभार्थी नाम,ชื่อผู้รับผลประโยชน์,Beneficiary Name,受益人姓名,Tên người thụ hưởng,nama Penerima,Beneficiary Name,Beneficiary Name,Nome Beneficiário,Nombre del beneficiario
UI_Cash_InputBeneficiaryName,input Beneficiary Name,इनपुट लाभार्थी नाम,ใส่ชื่อผู้รับเงิน,input Beneficiary Name,輸入收款人姓名,Nhập tên người thụ hưởng,masukan Nama Penerima,input Beneficiary Name,input Beneficiary Name,input Beneficiary Name,ingrese el nombre del beneficiario
UI_Hall_FeatureDevelopment,This feature is under development,यह सुविधा विकास के अधीन है,ฟีเจอร์นี้อยู่ระหว่างการพัฒนา,This feature is under development,此功能正在開發中,Tính năng này đang được phát triển,Fitur ini sedang dalam pengembangan,This feature is under development,This feature is under development,Este recurso está em desenvolvimento,Esta función está en desarrollo.
UI_In-HouseBonus,In-House Bonus,इन-हाउस बोनस,โบนัสภายใน,In-House Bonus,內部獎金,Thưởng nội bộ,Bonus In-House,In-House Bonus,In-House Bonus,Bônus da Casa,Bono Interno
UI_Hall_Played,Recent,हाल ही का,ล่าสุด,Recent,最近的,Gần đây,Terkini,ఇటీవలి,अलीकडील,Recente,Reciente
UI_ExternGame,Are you sure you want to leave the game and return to the lobby?,क्या आप वाकई खेल छोड़कर लॉबी में वापस आना चाहते हैं?,คุณแน่ใจว่าต้องการออกจากเกมและกลับไปที่ล็อบบี้หรือไม่,Are you sure you want to leave the game and return to the lobby?,您確定要退出遊戲並返回大廳嗎？,Bạn có chắc chắn muốn thoát game và quay lại Đại Sảnh không?,Yakin ingin keluar dari permainan dan kembali ke lobi?,Are you sure you want to leave the game and return to the lobby?,Are you sure you want to leave the game and return to the lobby?,Tem certeza de que deseja sair do jogo e retornar ao lobby?,¿Seguro que quieres salir del juego y volver al lobby?
UI_SlotBonus,Slot Bonus,स्लॉट बोनस,โบนัสอิเล็กทรอนิกส์,Slot Bonus,電子獎金,Thưởng ăn tiền,Bonus Slot,Slot Bonus,Slot Bonus,Bônus de slot,Bono de tragamonedas
UI_LiveBonus,Live Bonus,लाइव बोनस,โบนัส Live,Live Bonus,真人獎金,Thưởng trực tiếp,Bonus Langsung,Live Bonus,Live Bonus,Bônus ao vivo,Bono en vivo
UI_Sports_Bonus,Sports Bonus,खेल बोनस,โบนัสกีฬา,Sports Bonus,體育獎金,Thưởng thể thao,Bonus Olahraga,Sports Bonus,Sports Bonus,Bônus esportivo,Bono Deportivo
UI_TotalBonus,Total Bonus,टोटल बोनस,เงินโบนัสทั้งหมด,Total Bonus,總獎金,Tổng thưởng,Total Bonus,Total Bonus,Total Bonus,Bônus Total,Bono total
UI_Total,Total,टोटल बोनस,เงินโบนัสทั้งหมด,Total,總獎金,Tổng cộng,Total,Total,Total,Total,Total
UI_Totalearned,Total earned,कुल कमाई,รายได้ทั้งหมด,Total earned,總收入,Tổng kiếm được,Total yang dihasilkan,Total earned,Total earned,Total ganho,Total de Ganancias
UI_Judge_ClickOnTheToolbar,Click on the toolbar below,नीचे दिए गए टूलबार पर क्लिक करें,คลิกที่แถบเครื่องมือด้านล่าง,Click on the toolbar below,點擊下方工具欄,Bấm vào thanh công cụ bên dưới,Klik pada bilah alat di bawah ini,Click on the toolbar below,Click on the toolbar below,Clique na barra de ferramentas abaixo,Haga clic en la barra de herramientas a continuación
UI_Judge_AndSelect,and select,और चयन करें,และเลือก,and select,並選擇,và chọn,dan pilih,and select,and select,e selecione,y seleccione
UI_InsufficientGold,Insufficient gold coins!,अपर्याप्त सोने के सिक्के!,เหรียญทองไม่พอ,Insufficient gold coins,金幣不足！,Không đủ xu vàng!,Koin emas tidak cukup!,తగినంత బంగారు నాణేలు!,"अपुरी सोन्याची नाणी, कृपया रिचार्ज करा",Moedas de ouro insuficientes!,¡Monedas de oro insuficientes!
UI_Judge_AddToHome,"""Add to Home Screen""","""होम स्क्रीन में जोड़ें""","""เพิ่มไปที่หน้าจอหลัก""","""Add to Home Screen""",“添加到主屏幕”,Thêm vào màn hình chính,Tambahkan ke Layar Utama,"""Add to Home Screen""","""Add to Home Screen""","""Adicionar à tela de inicial""",Añadir a la pantalla principal
UI_Dice_Add_to_Home_Screen,Add to Home Screen,होम स्क्रीन में जोड़ें,เพิ่มไปที่หน้าจอหลัก,Add to Home Screen,添加到主屏幕,Thêm vào màn hình chính,Tambahkan ke Layar Utama,Add to Home Screen,Add to Home Screen,Adicionar à tela inicial,Añadir a la pantalla principal
UI_UpgradeNextLvRichText,"<color=#ffffff>To upgrade to </c><color=#ffe71d>{VIPLV}</color>,you need to recharge <color=#ffe71d>{MINRECHARGE}</color> and <color=#ffe71d>{MINBET}</color> bet amount.","<color=#ffffff>में अपग्रेड करने के लिए </c><color=#ffe71d>{VIPLV}</color>,आपको रिचार्ज करना होगा <color=#ffe71d>{MINRECHARGE}</color> तथा <color=#ffe71d>{MINBET}</color> शर्त राशि.",<color=#ffffff>การอัปเกรดเป็น</c><color=#ffe71d>{VIPLV}</color>ต้องเติมเงิน<color=#ffe71d>{MINRECHARGE}</color> และเงินเดิมพัน <color=#ffe71d>{MINBET}</color>,"<color=#ffffff>To upgrade to </c><color=#ffe71d>{VIPLV}</color>,you need to recharge <color=#ffe71d>{MINRECHARGE}</color> and <color=#ffe71d>{MINBET}</color> bet amount.",<color=#ffffff>升級到</c><color=#ffe71d>{VIPLV}</color>需要充值<color=#ffe71d>{MINRECHARGE}</color>和<color=#ffe71d >{MINBET}</color> 投注金額。,"<color=#ffffff>Để nâng cấp lên </c><color=#ffe71d>{VIPLV}</color>, bạn cần sạc lại <color=#ffe71d>{MINRECHARGE}</color> và <color=#ffe71d >{MINBET}</color> số tiền đặt cược.","<color=#ffffff>Untuk meningkatkan sampai</c><color=#ffe71d>{VIPLV}</color>,kamu perlu melakukan pengisian<color=#ffe71d>{MINRECHARGE}</color> dan<color=#ffe71d>{MINBET}</color> jumlah taruhan.","<color=#ffffff>To upgrade to </c><color=#ffe71d>{VIPLV}</color>,you need to recharge <color=#ffe71d>{MINRECHARGE}</color> and <color=#ffe71d>{MINBET}</color> bet amount.","<color=#ffffff>To upgrade to </c><color=#ffe71d>{VIPLV}</color>,you need to recharge <color=#ffe71d>{MINRECHARGE}</color> and <color=#ffe71d>{MINBET}</color> bet amount.","<color=#ffffff>Para atualizar para </c><color=#ffe71d>{VIPLV}</color>, você precisa recarregar <color=#ffe71d>{MINRECHARGE}</color> e <color=#ffe71d >{MINBET}</color> suma aposta.","<color=#ffffff>Para actualizar a </c><color=#ffe71d>{VIPLV}</color>, debe recargar <color=#ffe71d>{MINRECHARGE}</color> y <color=#ffe71d >{MINBET}</color> monto de la apuesta."
UI_Get_it_later,Get it later,बाद में प्राप्त करें,รับในภายหลัง,Get it later,稍後獲取,Lát sau nhận,Dapatkan nanti,Get it later,Get it later,Pegar depois,Consíguelo más tarde
UI_GameIcon,Maintaining,को बनाए रखने,บำรุงรักษา,Maintaining,維護,Duy trì,Memperbaiki,Maintaining,Maintaining,Manutenção,mantenimiento
UI_Free_trial,Free trial,मुफ्त परीक्षण,ทดลองใช้งานฟรี,Free trial,免費試用,Dùng thử miễn phí,Uji coba gratis,Free trial,Free trial,Teste grátis,Prueba gratis
UI_Try_it_for_free,Try it for free,इसे मुफ़्त में आज़माएं,ทดลองเล่นฟรี,Try it for free,免費試玩,Dùng thử miễn phí,Cobalah secara gratis,Try it for free,Try it for free,Experimente Grátis,Pruébalo gratis
UI_Official_game,Cash Game,नकद खेल,เกมเงินสด,Official game,現金遊戲,Game tiền mặt,Permainan resmi,Official game,Official game,Jogo a dinheiro,Juego en efectivo
UI_Confirme,Continue,जारी रखें,ดำเนินการต่อ,Confirm,繼續,Tiếp tục,Melanjutkan,Confirm,Confirm,Continuar,continuar
UI_FreeNotice,"Feel free to practicehere and try our hotestdemos, enjoy!","यहाँ प्रयोग करने के लिए मुक्त हो जाओ और हमारे सर्वोत्तम दस्तावेज़ों की कोशिश करो, आनन्द करो!",ฝึกฝนที่นี่ได้ตลอด และลองแสดงการสาธิตสุดฮอตของเรา สนุกได้เลย!,"The experience field only provides players with familiar games, no recharge and withdrawal, and no participation in game activities",隨時在這裡練習並嘗試我們最熱門的演示，盡情享受吧！,Hãy thoải mái thực hành và thử các màn trình diễn hấp dẫn nhấ!,"Jangan ragu untuk berlatih di sini dan coba demo terbaru kami, selamat menikmati!","The experience field only provides players with familiar games, no recharge and withdrawal, and no participation in game activities","The experience field only provides players with familiar games, no recharge and withdrawal, and no participation in game activities","Sinta-se livre para praticar e experimentar nossos hotestdemos, aproveite!","Siéntete libre de practicar aquí y prueba nuestras demostraciones más calientes, ¡disfrútalo!"
UI_FreeInFreeGameNotice,"We have hundreds of mainstream and fun games
We can go to the experience field to experience our games","हमारे पास सैकड़ों मुख्यधारा और मजेदार खेल हैं
हम अपने खेलों का अनुभव करने के लिए अनुभव क्षेत्र में जा सकते हैं","เรามีเกมสนุกๆ ยอดนิยมหลายร้อยเกม
เราสามารถไปที่สนามประสบการณ์เพื่อลองเล่นเกมของเรา","We have hundreds of mainstream and fun games
We can go to the experience field to experience our games","我們有數百款主流有趣的遊戲
我們可以去體驗場體驗我們的遊戲","Chúng tôi có hàng trăm game phổ biến và thú vị
Chúng ta có thể đến khu vực trải nghiệm để trải nghiệm game","Kami memiliki ratusan permainan mainstream dan menyenangkan
Kita bisa pergi ke bidang pengalaman untuk mengalami permainan kita","We have hundreds of mainstream and fun games
We can go to the experience field to experience our games","We have hundreds of mainstream and fun games
We can go to the experience field to experience our games","Temos centenas de jogos principais e divertidos
Podemos ir ao campo de experiência para experimentar nossos jogos","Tenemos cientos de juegos populares y divertidos
Podemos ir al campo de experiencia para experimentar nuestros juegos"
UI_FreeInFreeEnterGame,Continue,जारी रखना,ดำเนินการต่อ,Continue,繼續,Tiếp tục,Melanjutkan,Continue,Continue,Continuar,continuar
